name,slug,era,human_host,height,weight,age,home_world,race,special_moves,first_appearance_year,description
Ultraman Hikari,ultraman-hikari,Heisei,"Kazuya Serizawa,Ryu Aihara",50,35000,22000,Land of Light ,Ultra,Knight Shoot,2006,"An Ultraman who became a member of the Inter Galactic Defence Force after being part of the Land of Light’s Space Science Technology Bureau. Under the name Hunter Knight Tsurugi he pursues the powerful monster Bogarlmons, but in defeating it he runs out of energy. He is revived by Mother of Ultra’s miraculous abilities and reborn as an Ultra Warrior. He was bestowed the name Ultraman Hikari by Ryu, the captain of CREW GUYS.
He can use the same special attacks as Tsurugi, such as the Knight Beam Blade, Knight Shoot, and Blade Shot, and he is seen using the Twin Stream Lancer when fighting with Mebius.
He continued to fight on Earth after defeating Bogarl, but the strain on his body was too intense and so he returned to the Land of Light. He came back to Earth after being officially made a member of the Inter Galactic Defence Force. He fought as an ally of Mebius and then left Earth after the final battle against the Dark Great Space Emperor Alien Empera.
His human form was the former captain of CREW GUYS, Kazuya Serizawa. Kazuya retained his own will and transformed by equipping the Knight Brace, as Tsurugi had. In the final battle against Alien Empera, Ryu is also able to transform into Hikari after being entrusted with the Knight Brace by Kazuya."
Ultraman Zero,ultraman-zero,Heisei,"Run,Nozomo Taiga,Shin Moroboshi, Leito Igaguri",49,35000,5900,Land of Light ,Ultra,Zero Twin Shoot,2009,"A young Ultra Warrior and the son of Ultra Seven. He detests the stiffness of tradition and longs to live his life freely.
He possesses a speedy fighting style, and fights with light techniques inherited from his father Seven like his special attack Emerium Slash and Wide Zero Shot, as well as the Zero Sluggers. He was also trained in Space Martial Arts by Ultraman Leo and Astra.
As punishment for trying to claim the power of the Plasma Spark Energy Core, the power source of the Land of Light, he is exiled from the Land of Light to spend his days in training with Ultraman Leo and Astra on Planet K76. Later he would fight against Belial, where he would defeat Belial’s monster army and the monster Belyudra that Belial created.
Afterwards he travels to a different Universe and merges with a brave young man, Run. Run transforms into Ultraman Zero by putting on the Ultra Zero Eye, and they go on to fight against Belial’s newly-formed Galactic Empire Army."
Ultraman Saga,ultraman-saga,Heisei,"Nozomu Taiga,Shin Asuka,Musashi Haruno",58,45000,,Planet Earth,Super Ultra,"Saga Plasma,Saga Slasher,Saga Triple Slasher",2012,"Ultraman Saga is a Super Ultraman who is a fusion of Zero, Dyna, and Cosmos, similar to how the latter fuses with Ultraman Justice into Ultraman Legend. His only appearance was in the 2012 film Ultraman Saga."
Ultraman Ginga,ultraman-ginga,Reiwa,"Hikaru Raido,Misuzu Isurugi",,,,Unknown,Ultra,Ginga Cross Shoot,2013,"Ultraman Ginga
At one time, all of the Ultra warriors, along with the monsters and aliens, were turned into Spark Dolls by the mysterious Dark Spark. Time passed, and the youth Hikaru Rido got hold of the mysterious Ginga Spark, which could return the monsters and Ultra warriors to their previous giant forms. In order to protect those dear to him, Hikaru Ult-Lives the Ultras and monsters and faces off against the evil monsters.
Ultraman Ginga S
This is the sequel to Ultraman Ginga. It is two years later, and the defense team that didn’t appear in the previous show, as well as another Ultraman, Ultraman Victory, make their appearances. In addition, Ultraman Ginga returns to obey the will of Hikaru Rido, who is guided by the mysterious crystalline substance known as Victorium. Now, a new battle begins."
Ultraman Ribut,ultraman-ribut,Reiwa,Terasawa,40,40000,5700,Land of Light ,Ultra,Galaxium Blaster,2014,"Ultraman Ribut, a member of the “Galaxy Rescue Force” is responsible for protecting and saving the innocent creatures in need of help.
He has special moves powered by the “G Crystal”, on his arms and legs.
Ultraman Ribut fights with his martial arts skills.
He equips a shield called “Ribut Blocker” on his left arm."
Ultraman Victory,ultraman-victory,Reiwa,Sho,,,,Space,Ultra,Victorium Shoot,2014,"Sho, a youth from the underworld Victorian, can transform into this Ultraman. It has great fighting abilities and possesses a wealth of special moves. In addition, by scanning monsters that have become Spark Dolls with the Victory Lancer, it can manifest these monsters’ characteristics and powers through its right arm, and use them as weapons. It can fight for approximately three minutes."
Ultraman Gingavictory,ultraman-gingavictory,Reiwa,"Hikaru Raido,Sho",,,,Planet Earth,Super Ultra,"Gingavictory Hyper Punch,Gingavictory Hyper Kick",2015,"Ultraman Gingavictory is a fusion of Ultraman Ginga and Victory, achieved when both Hikaru and Sho scan the Ultra Fusion Brace with the Victory Lancer. Thanks to the Ultra Fusion Brace, Gingavictory gains access to most of the main Heisei Ultra's powers in addition to his original and Victory's attacks. He still has Star Mark-like features on his head from Ginga Strium and most of his appearance change to resemble that of Victory."
Ultraman X,ultraman-x,Reiwa,Daichi Oozora,45,45000,,Unknown,Ultra,Xanadium Beam,2015,"This production of “ULTRAMAN X” depicts the magnificence of communication and encounter of the unknown through the two persons with different characteristics who change themselves for the better as they work together face a crisis of the earth, one is Ultraman that descended from the space and put its spirit into the “Xdevizer” which is the different form of the multi-device held by the “Xio” member of the earth defense team, the other is the protagonist “Daichi Oozora” who uses the item.
It portrays the importance of the power of the connected hearts through two differently directed things intersecting and connecting with each other highlighting “the communication with the unknown.”"
Ultraman Orb,ultraman-orb,Reiwa,Gai Kurenai,50,50000,,Planet 0-50,0-50 Ultra,Orb Supreme Calibur,2016,"Ultraman Orb “The Warrior of Light” roamed around the world for a long period of time in the human form “Kurenai Gai” in order to stop the resurrection of Lord Monster and defeat Maga-Orochi. At last, Gai found its trace in Japan and used Fusion-Up by transforming the energy of Orb Ring (Transformation Item) ,which was used by Ultraman to seal Lord Monster, into Ultra Fusion Card. It embarks on a great adventure so as to seal Lord Monster and Maga-Orochi and maintain peace on earth."
Ultraman Geed,ultraman-geed,Reiwa,Riku Asakura,51,41000,19,Ultra,Planet Earth,Wrecking Burst,2017,"This is a story of a hero who inherits the evil ULTRAMAN BELIAL’s genes. Despite suffering from repeating setbacks and despair of knowin g the secrets of his birth and cruel fate, he never loses sight of friendship and strong will to become a real HERO. The story unfolds through the spiritual growth of such a person who seeks for the “meaning of his own life” and “meaning of his existence"" to find the place where he belongs and through the fight against evils and his own cursed fate transforms into a hero of justice; ULTRAMAN."
Ultraman Rosso,ultraman-rosso,Reiwa,Katsumi Minato,52,45000,23,Planet 0-50,0-50 Ultra,Flame Sphere Shoot,2018,"ULTRAMAN R/B is the first ever Ultraman series to feature two brothers “Katsumi Minato” and “Isami Minato” who transform into Ultraman.

The elder brother Katsumi transforms into Ultraman Rosso by using a R/B Crystal and the R/B Gyro.
His basic type is Ultraman Rosso Flame, transformed using Taro Crystal that contains the attribute of ""Fire"".
Inheriting characteristics from Katsumi, Ultraman Rosso overwhelms his enemies by power fighting hand-in-hand while observing his surroundings during the battle."
Ultraman Blu,ultraman-blu,Reiwa,Isami Minato,51,43000,19,Planet 0-50,0-50 Ultra,Aqua Strium,2018,"ULTRAMAN R/B is the first ever Ultraman series to feature two brothers “Katsumi Minato” and “Isami Minato” who transform into Ultraman.

The younger brother Isami transforms into Ultraman Blu by using a R/B Crystal and the R/B Gyro.
The basic type is Ultraman Blu Aqua, transformed using Ginga Crystal that contains the attribute of ""Aqua"".
Inheriting characteristics from Isami, Ultraman Blu's boldness helps him to get his first win in the battle, and he also strikes his enemies’ weak points while playing with them using his speed."
Ultrawoman Grigio,ultrawoman-grigio,Reiwa,Asahi Minato,43,30000,17,Planet Earth,0-50 Ultra,Grigio Cheer Charge,2018,"Ultrawoman Grigio is transformed by Asahi Minato, the younger sister of Ultraman Rosso (a.k.a. Katsumi Minato) and Ultraman Blu (a.k.a. Isami Minato). Her kind personality makes her excel at defense, and her determination to protect Ayaka City, entrusted to her by her brothers, has led her to gradually improve her combat abilities."
Ultraman Taiga,ultraman-taiga,Reiwa,Hiroyuki Kudo,50,40000,4800,Land of Light ,Ultra,Strium Blaster,2019,"Ultraman Taiga is the son of Ultraman Taro who protected Earth in the past. Deep inside, he aims to gain acknowledgement and recognition from his father Taro, but is sometimes difficult to admit his true feelings. He is hot-blooded and has a strong sense of justice. He founded “Tri-Squad” along with Titas and Fuma. Even though he is young and immature, he strives to fight for peace. Together with Hiroyuki and his friends, he grows up to be a true Ultraman."
Ultraman Titas,ultraman-titas,Reiwa,Hiroyuki Kudo,55,50000,9000,"Dark Nebula,Planet U40",Ultra People,Planium Buster,2019,"Ultraman Titas is the second Ultraman that dwells inside Hiroyuki. He is a warrior and a sage from the Star of Ultra U40, a different planet from Land of Light where Ultraman Joneus comes from. He is a likable fellow who has a well-trained body with a sound mind, and thus was given the “Star Symbol” by the great sage at a young age. He fights making best use of his heavyweight body and abundant strength."
Ultraman Fuma,ultraman-fuma,Reiwa,Hiroyuki Kudo,48,25000,5000,Planet 0-50,0-50 Ultra,Polar-Star Light Wave,2019,"Ultraman Fuma is the third Ultraman that dwells inside Hiroyuki. He is from Planet O-50, where the power to become the Warrior of Light was bestowed to Ultraman Orb, Rosso and Blu. He is agile, has various moves, and favors speedy fighting tactics like a ninja. He is wild but also loyal."
Ultraman Z,ultraman-z,Reiwa,Haruki Natsukawa,52,33000,5000,Land of Light ,Ultra,Zestium Beam,2020,"A rookie Ultraman who looked up to Zero and became his disciple, working hard for his position. Although Zero recognizes Z’s talent and potential, he says that in his current state Z is only “half or maybe one-third” of a fully-fledged hero. Tough and athletic, Z always operates at full power. Z also has a humorous side, as he is unused to Earth’s culture and sometimes
uses words incorrectly. Although Z is inexperienced and still developing, he’s a passionate hero who loves peace and justice more than anyone."
Ultraman Trigger,ultraman-trigger,Reiwa,Kengo Manaka,53,44000,,Unknown,Ancient Ultra,"Zeperion Beam,Zeperion Sword Finish,Zeperion Claw Impact,Zeperion Arrow Strike",2021,"After sealing away the Giants of Darkness who rampaged through the world in the Ultra- Ancient times to the far ends of space, Trigger turned into a stone statue in Mars but is revived when he merged with Kengo merged with the Gaint’s statue. Since then, Kengo transforms into Trigger with the “GUTS Sparklence”. Trigger has the ability to Type Change into other forms, such as Power Type and Sky Type. He fights with a diverse array of beam attacks, as well as the sacred weapon “Circle Arms” which can transform into a sword, claw, and arrow."
Ultraman Regulos,ultraman-regulos,Reiwa,None,52,47000,,Unknown,Ultra,,2020,"A mysterious Ultraman held captive by the Absolutians.
He learned the Cosmo Beast Style on Planet D60, a space martial arts said to be the strongest in the universe.
His right arm’s crest holds the power of the Lightning White Tiger Fist, and his left crest the Flaming Red Dragon Fist."
Ultraman Decker,ultraman-decker,Reiwa,"Kanata Asumi,Decker Asumi",55,45000,,Unknown,Ultra,,2022,"The Giant of Light that protagonist Kanata Asumi transforms into.
His basic form is called the Flash Type, and he can Type Change into the physically powerful Strong Type and the supernaturally powerful Miracle Type."
Ultraman Blazar,ultraman-blazar,Reiwa,Gento Hiruma,47,42000,,M421 Blazar,Ultra,Spiral Burrade,2023,"An Ultraman that Gento Hiruma transforms into. He is a Giant of Light that came from M421, a blazar far away from Earth.

When Gento strongly desires power for the sake of justice, the transformation item, Blazar Brace, appears on his left arm. While strongly imbuing his wishes into the crystal Blazer Stone, which holds the power of light, he then loads it into the Blazer Brace and transforms into Ultraman Blazar."
Ultraman Arc,ultraman-arc,Reiwa,Yuma Hize,48,32000,,Unknown,Ultra,Arc Finalize,2024,"A Giant of Light who appears after the protagonist, Yuma, unleashes his imagination and unites with Rution, the being of light from a faraway galaxy. His appearance is exactly the same as Yuma’s childhood sketch of the “Strongest Hero.” Yuma transforms into Ultraman Arc by inserting the Arc Cube, infused with power, into the Arc Ariser, which resembles his other sketch of the “Transformation Item,” and unleashing the light."